{
  "schemaVersion": 1,
  "id": "aivon-python-service",
  "name": "Aivon Python Service",
  "description": "Standard Python FastAPI feature modular service profile",
  "selection": {
    "projectType": "backend-service",
    "language": "python",
    "framework": "fastapi",
    "blueprint": "python-fastapi-feature-modular",
    "maturity": "operational",
    "capabilities": [
      "unit-tests",
      "docker",
      "github-actions",
      "structured-logging",
      "opentelemetry"
    ]
  },
  "variables": {
    "sourceLayout": "src"
  },
  "output": "{{projectName}}"
}
